{
  "name": "Captcha",
  "description": "",
  "icon": "",
  "tags": [],
  "authors": [
    "rivet-gg",
    "ABCxFF"
  ],
  "status": "stable",
  "scripts": {
    "verify_response": {
      "name": "Verify Captcha Response"
    }
  },
  "errors": {
    "captcha_failed": {
      "name": "Captcha Challenge Failed"
    }
  }
}
