{
    "name": "Authentication",
    "description": "Authenticate users with multiple authentication methods.",
    "icon": "key",
    "tags": [
        "core",
        "auth",
        "user"
    ],
    "authors": [
        "rivet-gg",
        "NathanFlurry"
    ],
    "status": "stable",
    "dependencies": {
        "email": {},
        "users": {},
        "rate_limit": {}
    },
    "scripts": {
        "send_email_verification": {
            "name": "Send Email Verification",
            "description": "Send a one-time verification code to a user's email address to authenticate them.",
            "public": true
        },
        "complete_email_verification": {
            "name": "Complete Email Verification",
            "description": "Verify a user's email address with a one-time verification code.",
            "public": true
        }
    },
    "errors": {
        "provider_disabled": {
            "name": "Provider Disabled"
        },
        "verification_code_invalid": {
            "name": "Verification Code Invalid"
        },
        "verification_code_attempt_limit": {
            "name": "Verification Code Attempt Limit"
        },
        "verification_code_expired": {
            "name": "Verification Code Expired"
        },
        "verification_code_already_used": {
            "name": "Verification Code Already Used"
        },
        "email_already_used": {
            "name": "Email Already Used"
        }
    }
}
